{
  "arm": "A",
  "asset_conflicts": 0,
  "coordination_seconds": 0,
  "dependency_conflicts": 0,
  "duplicate_or_abandoned_work": 0,
  "fanout_elected": false,
  "harness_failure": false,
  "human_intervention_minutes": 0,
  "infrastructure_cost_usd": 0,
  "interface_conflicts": 0,
  "merge_conflicts": 0,
  "model_cost_usd": null,
  "predicted_path_drift_count": 0,
  "provider_wait_seconds": 0,
  "quality_score": 0,
  "rescue_events": 0,
  "run_id": "vs-p0b-008",
  "schema_version": "task-parallelism-phase-0b-candidate-result.v1",
  "semantic_conflicts": 0,
  "skill_context_tokens": 0,
  "skill_loads": 10,
  "terminal_status": "candidate-failed",
  "tokens": {
    "cached_input": 15684864,
    "input": 15979775,
    "output": 67662
  },
  "wall_clock_seconds": 1556,
  "worker_count": 1
}
